<?xml version="1.0" encoding="UTF-8"?>
<!-- vim:set expandtab shiftwidth=2 softtabstop=2 tabstop=8: -->
<sorm pkg="net.jonp.sorm.example"
      name="Person"
      xmlns="http://jonp.net/sorm"
      xmlns:xsi="http://www.w3.org/2001/XMLSchema-instance"
      xsi:schemaLocation="http://jonp.net/sorm http://jonp.net/sorm/sorm.xsd">

    <field type="Integer" name="id" primary="true" />

    <field type="String" name="name" sql-type="String" />

    <field type="Address" name="address" group="true">
        <set>%{}.setAddress(new Address(%{address.number}, %{address.street}, %{address.apartment}, %{address.city}, %{address.state}, %{address.zipcode}))</set>
    </field>

    <field type="String" name="number" parent="address" sql-column="addr_number">
        <get>%{}.getNumber()</get>
    </field>

    <field type="String" name="street" parent="address" sql-column="addr_street">
        <get>%{}.getStreet()</get>
    </field>

    <field type="String" name="apartment" parent="address" sql-column="addr_apt" nullable="true">
        <get>%{}.getApartment()</get>
    </field>

    <field type="String" name="city" parent="address" sql-column="addr_city">
        <get>%{}.getCity()</get>
    </field>

    <field type="String" name="state" parent="address" sql-column="addr_state">
        <get>%{}.getState()</get>
    </field>

    <field type="String" name="zipcode" parent="address" sql-column="addr_zip">
        <get>%{}.getZipcode()</get>
    </field>

    <field type="Integer" name="mother" nullable="true">
        <link mode="ManyToOne" key-type="Integer" type="Person" />
    </field>

    <field type="Integer" name="father" nullable="true">
        <link mode="ManyToOne" key-type="Integer" type="Person" />
    </field>

    <field type="String" name="gender" sql-type="String" sql-column="sex" />

    <field type="java.util.Date" name="dob" sql-type="Date">
        <get>new java.sql.Date(%{}.getDob().getTime())</get>
        <set>%{}.setDob(new java.util.Date(%{dob}.getTime()))</set>
    </field>

    <field type="Integer" name="spouse" nullable="true">
        <link mode="OneToOne" key-type="Integer" type="Person" />
    </field>

    <field name="children" type="Collection&lt;Person&gt;">
        <link mode="OneToMany" key-type="Integer" type="Person">
            <collection>
                <read>
                    <r>
select id
  from person
 where mother = %{id}
    or father = %{id}
                    </r>
                </read>
            </collection>
        </link>
    </field>

    <field name="friends" type="Collection&lt;Person&gt;">
        <link mode="ManyToMany" key-type="Integer" type="Person">
            <collection>
                <read>
                    <r dialect="sqlite">
<!-- SQLite does not support multiple-insert, so it pays for that in longer selects -->
select person_id2 as id
  from friendmap
 where person_id1 = %{id}
union
select person_id1
  from friendmap
 where person_id2 = %{id}
                    </r>
                    <r dialect="*">
select person_id2 as id
  from friendmap
 where person_id1 = %{id}
                    </r>
                </read>
                <create>
                    <c dialect="sqlite">
<!-- SQLite only keeps a single pair because it does not support multiple-insert -->
insert
  into friendmap
  (person_id1, person_id2) values
  (%{1.id},    %{2.getId():Integer})
                    </c>
                    <c dialect="*">
insert
  into friendmap
  (person_id1, person_id2) values
  (%{1.id},                 %{2.getId():Integer}),
  (%{2.getId():Integer},    %{1.id})
                    </c>
                </create>
                <delete>
                    <d>
delete
  from friendmap
 where (person_id1 = %{1.id}
    and person_id2 = %{2.getId():Integer})
    or (person_id1 = %{2.getId():Integer}
    and person_id2 = %{1.id})
                    </d>
                </delete>
            </collection>
        </link>
    </field>

    <create>
        <c>
        <!-- TODO: Insert, read, and update address info, and add another query (byAddress) -->
insert into person (name,    mother,    father,    sex,       dob,    spouse,
                    addr_number,       addr_street,       addr_apt,
                    addr_city,       addr_state,       addr_zip)
            values (%{name}, %{mother}, %{father}, %{gender}, %{dob}, %{spouse},
                    %{address.number}, %{address.street}, %{address.apartment},
                    %{address.city}, %{address.state}, %{address.zipcode})
        </c>
    </create>

    <pk>
        <pk dialect="mysql">
            select last_insert_id() as id
        </pk>
        <pk dialect="postgresql">
            select curval('person_id_seq') as id
        </pk>
        <pk dialect="sqlite">
            select last_insert_rowid() as id
        </pk>
    </pk>

    <read>
        <r>
select name,
       mother,
       father,
       sex,
       dob,
       spouse,
       addr_number,
       addr_street,
       addr_apt,
       addr_city,
       addr_state,
       addr_zip
  from person
 where id = %{}
        </r>
    </read>

    <update>
        <u>
update person
   set name = %{name},
       mother = %{mother},
       father = %{father},
       sex = %{gender},
       dob = %{dob},
       spouse = %{spouse},
       addr_number = %{address.number},
       addr_street = %{address.street},
       addr_apt = %{address.apartment},
       addr_city = %{address.city},
       addr_state = %{address.state},
       addr_zip = %{address.zipcode}
 where id = %{id}
        </u>
    </update>

    <delete>
        <d>
delete
  from person
 where id = %{id}
        </d>
    </delete>

    <query name="getByGender">
        <param type="String" name="gender" />
        <q>
            select id from person where sex = %{gender}
        </q>
    </query>

    <query name="getByDob">
        <param type="java.util.Date" name="dob" sql-type="Date">
            <set>new java.sql.Date(%{}.getTime())</set>
        </param>
        <q>
            select id from person where dob = %{dob}
        </q>
    </query>

    <query name="getByAddress">
        <param type="String" name="number" />
        <param type="String" name="street" />
        <param type="String" name="apartment" />
        <param type="String" name="city" />
        <param type="String" name="state" />
        <param type="String" name="zipcode" />
        <q>
select id
  from person
 where addr_number = %{number}
   and addr_street = %{street}
   and addr_apt = %{apartment}
   and addr_city = %{city}
   and addr_state = %{state}
   and addr_zip = %{zipcode}
        </q>
    </query>
</sorm>
